### ISSUE TITLE
GMail smtp notification incorrectly detects TLS support

### ISSUE THREAD

**Issue by akusei** [authelia/authelia#1146]
I've tried to figure out what the actual problem is here but can't say exactly where the cause is but I have SMTP notifications turned on and I'm using the gmail smtp-relay server over TLS on port 587 with an app password. When my authelia container is first created and I visit my auth page and click the link to register or the link to send an email for a password reset it almost always comes back with an error stating `There was a problem initiating the registration process`. In the docker logs it shows

```
level=info msg="Logging severity set to debug"
level=debug msg="Notifier SMTP client initializing TLS configuration"
level=info msg="Authelia is listening for non-TLS connections on 0.0.0.0:9091"
level=info msg="Access to https://mydomain.tld/ is not authorized to user , redirecting to https://auth.mydomain.tld?rd=https%3A%2F%2Fmydomain.tld%2F" method=GET path=/api/verify remote_ip=192.168.1.128
level=info msg="Access to https://stats.mydomain.tld/ is not authorized to user , redirecting to https://auth.mydomain.tld?rd=https%3A%2F%2Fstats.mydomain.tld%2F" method=GET path=/api/verify remote_ip=192.168.1.128
level=debug msg="Credentials validation of user myuser is ok" method=POST path=/api/firstfactor remote_ip=192.168.1.128
level=debug msg="Mark authentication attempt made by user myuser" method=POST path=/api/firstfactor remote_ip=192.168.1.128
level=debug msg="Required level for the URL https://stats.mydomain.tld/ is 2" method=POST path=/api/firstfactor remote_ip=192.168.1.128
level=warning msg="https://stats.mydomain.tld/ requires 2FA, cannot be redirected yet" method=POST path=/api/firstfactor remote_ip=192.168.1.128
level=debug msg="Sending an email to user myuser (myuser@email.com) to confirm identity for registering a device." method=POST path=/api/secondfactor/totp/identity/start remote_ip=192.168.1.128
level=debug msg="Notifier SMTP client attempting connection to smtp-relay.email.com:587"
level=debug msg="Notifier SMTP client connected successfully"
level=warning msg="Notifier SMTP client encountered error during cleanup: EOF"
level=error msg="Notifier SMTP server does not support TLS and it is required by default (see documentation if you want to disable this highly recommended requirement)" method=POST path=/api/secondfactor/totp/identity/start remote_ip=192.168.1.128 stack="github.com/authelia/authelia/internal/middlewares/authelia_context.go:64      (*AutheliaCtx).Error\ngithub.com/authelia/authelia/internal/middlewares/identity_verification.go:86 IdentityVerificationStart.func1\ngithub.com/authelia/authelia/internal/middlewares/require_first_factor.go:15  RequireFirstFactor.func1\ngithub.com/authelia/authelia/internal/middlewares/authelia_context.go:49      AutheliaMiddleware.func1.1\ngithub.com/fasthttp/router@v1.2.2/router.go:348                               (*Router).Handler\ngithub.com/authelia/authelia/internal/middlewares/log_request.go:14           LogRequestMiddleware.func1\ngithub.com/valyala/fasthttp@v1.14.0/server.go:2162                            (*Server).serveConn\ngithub.com/valyala/fasthttp@v1.14.0/workerpool.go:223                         (*workerPool).workerFunc\ngithub.com/valyala/fasthttp@v1.14.0/workerpool.go:195                         (*workerPool).getCh.func1\nruntime/asm_amd64.s:1373                                                      goexit"
```

I'm running version 4.20 of Authelia and this only happens once or twice the very first time I try and reset a password or register a device after the container is created. After the initial failure or two, it works and sends the email without even needing to restart the container or navigate away from the page

existing Authelia configuration

```
host: 0.0.0.0
port: 9091
log_level: debug

jwt_secret: "super-secret"

default_redirection_url: https://mydomain.tld

totp:
  issuer: mydomain

authentication_backend:
  file:
    path: /config/users.yml
    password:
      algorithm: argon2id
      iterations: 1
      salt_length: 16
      parallelism: 8
      memory: 1024

access_control:
  default_policy: deny
  rules:
    - domain: "auth.mydomain.tld"
      policy: bypass

    - domain:
        - www.mydomain.tld
        - mydomain.tld
      resources:
        - "^/plugins/images/favicon/site.webmanifest$"
      policy: bypass

    - domain:
        - request.mydomain.tld
        - watch.mydomain.tld
        - www.mydomain.tld
        - mydomain.tld
      subject: group:users
      policy: two_factor

    - domain: "*.mydomain.tld"
      subject: group:admins
      policy: two_factor

session:
  name: mydomain_session
  secret: "super-long-secret"
  expiration: 7200
  inactivity: 3600
  domain: mydomain.tld
  remember_me_duration: 1M

regulation:
  max_retries: 3
  find_time: 2m
  ban_time: 12h

storage:
  local:
    path: /config/db.sqlite3

notifier:
  disable_startup_check: true
  smtp:
    username: myuser@mydomain.tld
    password: google app password
    host: smtp-relay.gmail.com
    port: 587
    sender: no-reply@mydomain.tld
    subject: "[2FA] {title}"
    disable_require_tls: false
```

**Comment by james-d-elliott** [comment]
So looking at your logs, it's attempting to cleanup but getting EOF (SMTP server terminated the connection or connection was closed abruptly).  Is there a purpose to use smtp-relay? I'm guessing gsuite user.

**Comment by akusei** [comment]
Yes, you're correct, I'm using gsuite so I can send emails from no-reply@mydomain.tld to any domain. What's weird is that it works on the second attempt, just never the first

**Comment by james-d-elliott** [comment]
Yeah it seems to be at gmails end but I'm trying to narrow down how we can account for it.

**Comment by james-d-elliott** [comment]
@clems4ever @nightah  I think what's happening is smtp-relay.gmail.com is doing some form of greylisting specific to them. I'm thinking the correct way to handle this is to add a configuration option like below which would make sure if a failure occurs to attempt again.

```yaml
notifier:
  disable_startup_check: true
  smtp:
    username: myuser@mydomain.tld
    password: google app password
    host: smtp-relay.gmail.com
    port: 587
    sender: no-reply@mydomain.tld
    subject: "[2FA] {title}"
    disable_require_tls: false
    enable_auto_retry: true
```

**Comment by akusei** [comment]
This might have been on google's end entirely. I have no idea why it was working at all actually. Spent some time with Google on this and it turns out the smtp-relay security settings needed to be lessened a bit to allow the sending from no-reply. Still have no idea why it would work sometimes and other times not though.

I did some more tests after the settings change and the emails appear to be working properly now. You can probably close this as a non-issue with authelia and something on Gsuite's end. If I encounter the issue again, I'll reopen but I don't think it'll be a problem anymore

**Comment by james-d-elliott** [comment]
I was having intermittent issues yesterday when I was testing. Unsure if it's related. Looked to resolve itself later. I'll close this for now, feel free to reopen if you have further issues though @akusei  and thanks for reporting it.

**Comment by wouterbouvy** [comment]
@akusei I'm running in this exact same issue after updating docker to 19.03.13 today.
Can you elaborate on the changes you have done on Googles end? I'm also using G-Suite to send my mails

**Comment by james-d-elliott** [comment]
This issue was a temporary one on Google's end. You can replicate it over a telnet session. There was no fix/changes.

**Comment by wouterbouvy** [comment]
I diverted to personal Gmail Google SMTP for now and will check again in a few days

**Comment by akusei** [comment]
Turns out this is still a problem for gmail SMTP relay but I think I've figured out what the issue is. It appears Authelia is sending `localhost` as the hostname for the SMTP `EHLO` and `HELO` commands. Google doesn't like this at all. I was able to reproduce the issue with an smtp command line testing tool and the issue was fixed when I told the tool to use my actual hostname/domain that google recognizes. Here's a tcpdump of the traffic coming from Authelia going to the smtp relay.

```
00:31:26.339712 IP (tos 0x0, ttl 128, id 44057, offset 0, flags [none], proto TCP (6), length 97)
    74.125.137.28.submission > 192.168.111.128.60332: Flags [P.], cksum 0xcf98 (correct), seq 1:58, ack 1, win 64240, length 57
	0x0000:  4500 0061 ac19 0000 8006 8abb 4a7d 891c  E..a........J}..
	0x0010:  c0a8 6f80 024b ebac 409d 1a6b d928 322e  ..o..K..@..k.(2.
	0x0020:  5018 faf0 cf98 0000 3232 3020 736d 7470  P.......220.smtp
	0x0030:  2d72 656c 6179 2e67 6d61 696c 2e63 6f6d  -relay.gmail.com
	0x0040:  2045 534d 5450 206e 3236 736d 3130 3435  .ESMTP.n26sm1045
	0x0050:  3030 6f74 662e 3620 2d20 6773 6d74 700d  00otf.6.-.gsmtp.
	0x0060:  0a                                       .
00:31:26.339759 IP (tos 0x0, ttl 63, id 1698, offset 0, flags [DF], proto TCP (6), length 40)
    192.168.111.128.60332 > 74.125.137.28.submission: Flags [.], cksum 0x03dd (incorrect -> 0x5cca), seq 1, ack 58, win 64183, length 0
	0x0000:  4500 0028 06a2 4000 3f06 316c c0a8 6f80  E..(..@.?.1l..o.
	0x0010:  4a7d 891c ebac 024b d928 322e 409d 1aa4  J}.....K.(2.@...
	0x0020:  5010 fab7 03dd 0000                      P.......
00:31:26.339881 IP (tos 0x0, ttl 63, id 1699, offset 0, flags [DF], proto TCP (6), length 56)
    192.168.111.128.60332 > 74.125.137.28.submission: Flags [P.], cksum 0x03ed (incorrect -> 0xf0f0), seq 1:17, ack 58, win 64183, length 16
	0x0000:  4500 0038 06a3 4000 3f06 315b c0a8 6f80  E..8..@.?.1[..o.
	0x0010:  4a7d 891c ebac 024b d928 322e 409d 1aa4  J}.....K.(2.@...
	0x0020:  5018 fab7 03ed 0000 4548 4c4f 206c 6f63  P.......EHLO.loc
	0x0030:  616c 686f 7374 0d0a                      alhost..
00:31:26.340031 IP (tos 0x0, ttl 128, id 44058, offset 0, flags [none], proto TCP (6), length 40)
    74.125.137.28.submission > 192.168.111.128.60332: Flags [.], cksum 0x5c81 (correct), seq 58, ack 17, win 64240, length 0
	0x0000:  4500 0028 ac1a 0000 8006 8af3 4a7d 891c  E..(........J}..
	0x0010:  c0a8 6f80 024b ebac 409d 1aa4 d928 323e  ..o..K..@....(2>
	0x0020:  5010 faf0 5c81 0000 0000 0000 0000       P...\.........
00:31:26.396425 IP (tos 0x0, ttl 128, id 44059, offset 0, flags [none], proto TCP (6), length 120)
    74.125.137.28.submission > 192.168.111.128.60332: Flags [FP.], cksum 0x0752 (correct), seq 58:138, ack 17, win 64240, length 80
	0x0000:  4500 0078 ac1b 0000 8006 8aa2 4a7d 891c  E..x........J}..
	0x0010:  c0a8 6f80 024b ebac 409d 1aa4 d928 323e  ..o..K..@....(2>
	0x0020:  5019 faf0 0752 0000 3432 3120 342e 372e  P....R..421.4.7.
	0x0030:  3020 5472 7920 6167 6169 6e20 6c61 7465  0.Try.again.late
	0x0040:  722c 2063 6c6f 7369 6e67 2063 6f6e 6e65  r,.closing.conne
	0x0050:  6374 696f 6e2e 2028 4548 4c4f 2920 6e32  ction..(EHLO).n2
	0x0060:  3673 6d31 3034 3530 306f 7466 2e36 202d  6sm104500otf.6.-
	0x0070:  2067 736d 7470 0d0a                      .gsmtp..
```
It's not pretty to look at, sorry. If you can read through that, you'll see Authelia sending `localhost`. Is there a way to change what hostname Authelia will send? I tried setting `hostname` on the container but that doesn't work.

**Comment by akusei** [comment]
@james-d-elliott This may need to be re-opened. Or would you prefer I create a new ticket?

**Comment by wouterbouvy** [comment]
I also still have this same problem and diverted to smtp.gmail.com instead of smtp-relay.gmail.com as a workaround. Great find on the localhost @akusei

**Comment by akusei** [comment]
@james-d-elliott this should be a pretty easy fix from what I understand. The go module net/smtp has a Hello method used for this exact situation https://golang.org/pkg/net/smtp/#Client.Hello. It just needs to be called before any other methods in net/smtp and you'd need to add a configuration option for the hostname. I'd imagine this might affect more than just Google if the relay checks IPs of hostnames provided in HELO/EHLO

**Comment by nightah** [comment]
@akusei good find regarding the Google SMTP Relay limitation, for the record here's an [article with more detail](https://support.google.com/a/answer/2956491?hl=en) including the following extract:
> We recommend that you configure your mail server to present a unique identifier (such as your domain name or the name of your mail server) in the HELO or EHLO command in the SMTP relay connections your server makes to Google. Avoid using generic names such as "localhost" or "smtp-relay.gmail.com," which can occasionally result in issues with DoS limits.

I think your suggestion is a sane one @akusei, perhaps we should just default to sending `os.Hostname()` which in the case of Docker will be a randomly generated hostname and can be also customised with the `hostname` option too. This should also carry a sane default for non-Docker based deployments. Thoughts @james-d-elliott?

**Comment by akusei** [comment]
@wouterbouvy @nightah As a workaround for now, until this gets added, you can use the following postfix docker configuration. All it does is forward your mail from Authelia to gmail (gsuite) with the correct hostname. I've tested this and it works.

```yaml
postfix:
  image: juanluisbaptiste/postfix:alpine
  container_name: postfix
  restart: unless-stopped
  expose:
    - 25
  environment:
    SMTP_SERVER: smtp-relay.gmail.com
    SMTP_PORT: 587
    SMTP_USERNAME: gmail_username
    SMTP_PASSWORD: gmail_password
    SERVER_HOSTNAME: yourdomain.com
```

And in the Authelia configuration.yml you would put this for the notifier
```yaml
notifier:
  disable_startup_check: true
  smtp:
    host: postfix
    port: 25
    sender: from_email_address
    subject: "[2FA] {title}"
    disable_require_tls: true
```

**Comment by nightah** [comment]
Thanks @akusei, I don't actually use Gmail I host my own mail. Having said that what's the difference between `smtp-relay.gmail.com` and `smtp.gmail.com`? Since most users have suggested utilising the latter as a workaround.

**Comment by akusei** [comment]
@nightah The different is that `smtp-relay.gmail.com` is a true smtp relay which allows you to send emails as someone else. For example, if I want to send an email to all my users as `no-reply@mydomain.com` I can do this with `smtp-relay.gmail.com` but not with `smtp.gmail.com`. With smtp.gmail.com I would need to send the email from my actual email address. Google also imposes more requirements and security around `smtp-relay.gmail.com` than it does with `smtp.gmail.com` since it's a relay. Does that make sense?

**Comment by james-d-elliott** [comment]
Yeah, it's a simple fix. I identified it before I replied, just a matter of implementing a configuration key for it and call the method.

**Comment by james-d-elliott** [comment]
I've published a fix that should work. Try the authelia/authelia:bugfix-smtp-helo image. You will have to add the "identifier" key with the hostname you want to send with EHLO/HELO.

I updated the examples in the commit.

**Comment by akusei** [comment]
@james-d-elliott tested and it works perfectly!

**Comment by bozerkins** [comment]
Hello! Sorry if I'm late to the conversation, could we add examples for how to integrate with AWS SeS and Google SMTP? It's hard to debug this on the authelia's end by logs alone, so it's hard to find the right configuration for SMTP :)

**Comment by james-d-elliott** [comment]
I don't think adding examples for every SMTP provider is actually a maintainable solution as we cannot control them changing it in the future. Instead could you explain your issue and what would make the debug logs more helpful?

**Comment by bozerkins** [comment]
Sure! I had problems with configuring notifier. I was trying to configure notifier to use AWS SES SMTP 587 port. Initially the notifier was failing with "530 Authentication failed" error, which, I was thinking, was due to wrong password or communication protocol. One more theory was using the wrong port, as 587 doesn't require TLS to be enabled and works without enforcing it. After I verified that username and password work, I turned to debugging Authelia. I enabled trace logs, where I found that my Authelia installation hadn't received password for authentication, which is why it was skipping it.

I'm using 0.7.7 helm chart for deployment and had set password in secret, with key SMTP_PASSWORD. My first thought was that the secret wasn't being read, so I added the "password" field into notifier configuration, which didn't help. Then I dug deeper into chart and found out that notifier is one of the few resources in the chart that require "enabledSecret" parameter, otherwise it doesn't read the secret value. I enabled that and it worked.

My final configuration of notifier looks like this, with SMTP_PASSWORD located inside the secret.
```yaml
notifier:
  smtp:
    enabled: true
    enabledSecret: true
    host: amazon-smtp-host
    port: 587
    username: "<username>"
    sender: sender@example.com
    subject: "[Authentication] {title}"
    disable_require_tls: false
```
What I thought should be a trivial task turned out to be 1-2 hours of debugging. That's why I suggested having some examples of configurations for authelia (and hopefully for helm chart as well).

**Comment by james-d-elliott** [comment]
Makes sense, probably would be helpful with the helm chart. It's still in beta and people seem to regularly have issues. Thanks for the clarification!
